{
  "$schema": "https://json-schema.org/draft/2020-12/schema",
  "$id": "urn:pto-isa:agentic-circuit:schema:acsim-binding:0.2",
  "title": "Agentic Circuit ACSim Binding Record 0.2",
  "type": "object",
  "additionalProperties": false,
  "required": [
    "activation_sources",
    "availability",
    "binding",
    "binding_schema",
    "component_schema",
    "component_schema_fingerprint",
    "construction",
    "contract_epoch",
    "cpp",
    "cpp_type",
    "effect",
    "fingerprint",
    "implementation",
    "ownership",
    "parameters",
    "ports",
    "provider",
    "provider_implementation_fingerprint",
    "resources",
    "results"
  ],
  "properties": {
    "activation_sources": {
      "type": "array",
      "items": {"$ref": "#/$defs/activationSource"},
      "uniqueItems": true,
      "$comment": "BindingRecord semantic validation additionally requires unique activation-source names, which JSON Schema cannot express."
    },
    "availability": {"const": "available"},
    "binding": {"$ref": "#/$defs/name"},
    "binding_schema": {"const": "acsim-binding-0.2"},
    "component_schema": {"$ref": "#/$defs/identity"},
    "component_schema_fingerprint": {"$ref": "#/$defs/sha256"},
    "construction": {"$ref": "#/$defs/construction"},
    "contract_epoch": {"const": "0.2"},
    "cpp": {"$ref": "#/$defs/cpp"},
    "cpp_type": {"$ref": "#/$defs/identity"},
    "effect": {"enum": ["pure", "stateful"]},
    "fingerprint": {"$ref": "#/$defs/sha256"},
    "implementation": {"$ref": "#/$defs/identity"},
    "ownership": {"$ref": "#/$defs/ownership"},
    "parameters": {
      "type": "array",
      "items": {"$ref": "#/$defs/parameter"}
    },
    "ports": {
      "type": "array",
      "items": {"$ref": "#/$defs/port"}
    },
    "provider": {"$ref": "#/$defs/identity"},
    "provider_implementation_fingerprint": {"$ref": "#/$defs/sha256"},
    "resources": {
      "type": "array",
      "items": {"$ref": "#/$defs/resource"}
    },
    "results": {
      "type": "array",
      "items": {"$ref": "#/$defs/result"}
    }
  },
  "allOf": [
    {
      "if": {"properties": {"effect": {"const": "pure"}}},
      "then": {
        "properties": {
          "activation_sources": {"maxItems": 0},
          "ownership": {
            "properties": {
              "kind": {"const": "none"},
              "placement": {"const": "inline"}
            }
          },
          "cpp": {
            "properties": {
              "entry_points": {
                "properties": {
                  "pure": {"$ref": "#/$defs/cppSymbol"},
                  "reset": {"const": ""},
                  "validate": {"const": ""},
                  "work": {"const": ""},
                  "xfer": {"const": ""}
                }
              }
            }
          }
        }
      },
      "else": {
        "properties": {
          "ownership": {
            "properties": {
              "kind": {"const": "unique"},
              "placement": {"enum": ["member_or_array", "root_or_process"]}
            }
          },
          "cpp": {
            "properties": {
              "entry_points": {
                "properties": {
                  "pure": {"const": ""},
                  "work": {"$ref": "#/$defs/cppSymbol"},
                  "xfer": {"$ref": "#/$defs/cppSymbol"}
                }
              }
            }
          }
        }
      }
    }
  ],
  "$defs": {
    "name": {
      "type": "string",
      "pattern": "^[A-Za-z_][A-Za-z0-9_]*$"
    },
    "identity": {
      "type": "string",
      "pattern": "^[A-Za-z_][A-Za-z0-9_.]*$"
    },
    "cppSymbol": {
      "type": "string",
      "pattern": "^[A-Za-z_][A-Za-z0-9_]*(::[A-Za-z_][A-Za-z0-9_]*)*$"
    },
    "sha256": {
      "type": "string",
      "pattern": "^sha256:[0-9a-f]{64}$"
    },
    "typeString": {
      "type": "string",
      "minLength": 1,
      "pattern": "^[^;{}()=%#`\\r\\n]+$"
    },
    "staticValue": {
      "oneOf": [
        {"type": "null"},
        {"type": "boolean"},
        {"type": "integer", "minimum": -9007199254740991, "maximum": 9007199254740991},
        {"type": "number", "not": {"type": "integer"}},
        {"type": "string"},
        {"type": "array", "items": {"$ref": "#/$defs/staticValue"}},
        {
          "type": "object",
          "patternProperties": {
            "^[A-Za-z_][A-Za-z0-9_]*$": {"$ref": "#/$defs/staticValue"}
          },
          "additionalProperties": false
        }
      ]
    },
    "entryPoints": {
      "type": "object",
      "additionalProperties": false,
      "required": ["pure", "reset", "validate", "work", "xfer"],
      "properties": {
        "pure": {"type": "string"},
        "reset": {"type": "string"},
        "validate": {"type": "string"},
        "work": {"type": "string"},
        "xfer": {"type": "string"}
      }
    },
    "cpp": {
      "type": "object",
      "additionalProperties": false,
      "required": ["concept", "entry_points", "header", "symbol", "target"],
      "properties": {
        "concept": {"$ref": "#/$defs/cppSymbol"},
        "entry_points": {"$ref": "#/$defs/entryPoints"},
        "header": {
          "type": "string",
          "minLength": 1,
          "pattern": "^(?!/)(?!.*\\\\)(?!.*(?:^|/)\\.\\.(?:/|$)).+$"
        },
        "symbol": {"$ref": "#/$defs/cppSymbol"},
        "target": {"$ref": "#/$defs/name"}
      }
    },
    "construction": {
      "type": "object",
      "additionalProperties": false,
      "required": ["arguments", "kind"],
      "properties": {
        "arguments": {
          "type": "array",
          "items": {"$ref": "#/$defs/staticValue"}
        },
        "kind": {"const": "constructor"}
      }
    },
    "ownership": {
      "type": "object",
      "additionalProperties": false,
      "required": ["kind", "placement"],
      "properties": {
        "kind": {"enum": ["none", "unique"]},
        "placement": {"enum": ["inline", "member_or_array", "root_or_process"]}
      }
    },
    "parameter": {
      "type": "object",
      "additionalProperties": false,
      "required": ["acir_type", "cpp_type", "mapping", "name", "ordinal", "value"],
      "properties": {
        "acir_type": {"$ref": "#/$defs/typeString"},
        "cpp_type": {"$ref": "#/$defs/typeString"},
        "mapping": {"enum": ["template_argument", "constexpr_argument", "constructor_constant"]},
        "name": {"$ref": "#/$defs/name"},
        "ordinal": {"type": "integer", "minimum": 0},
        "value": {"$ref": "#/$defs/staticValue"}
      }
    },
    "port": {
      "type": "object",
      "additionalProperties": false,
      "required": ["accessor", "cardinality", "delegation", "direction", "interface", "ownership", "payload", "protocol", "role", "time_domain"],
      "properties": {
        "accessor": {"$ref": "#/$defs/name"},
        "cardinality": {"enum": ["exclusive", "shared"]},
        "delegation": {"enum": ["forbidden", "allowed", "required"]},
        "direction": {"enum": ["input", "output"]},
        "interface": {"$ref": "#/$defs/identity"},
        "ownership": {"enum": ["owned", "borrowed", "shared"]},
        "payload": {"$ref": "#/$defs/identity"},
        "protocol": {"$ref": "#/$defs/identity"},
        "role": {"$ref": "#/$defs/identity"},
        "time_domain": {"$ref": "#/$defs/identity"}
      }
    },
    "resource": {
      "type": "object",
      "additionalProperties": false,
      "required": ["accessor", "delegation", "mode", "ownership", "resource", "role", "time_domain"],
      "properties": {
        "accessor": {"$ref": "#/$defs/name"},
        "delegation": {"enum": ["forbidden", "allowed", "required"]},
        "mode": {"enum": ["initiator", "target"]},
        "ownership": {"enum": ["owned", "borrowed", "shared"]},
        "resource": {"$ref": "#/$defs/identity"},
        "role": {"$ref": "#/$defs/identity"},
        "time_domain": {"$ref": "#/$defs/identity"}
      }
    },
    "result": {
      "type": "object",
      "additionalProperties": false,
      "required": ["cpp_type", "name"],
      "properties": {
        "cpp_type": {"$ref": "#/$defs/identity"},
        "name": {"$ref": "#/$defs/name"}
      }
    },
    "activationSource": {
      "type": "object",
      "additionalProperties": false,
      "required": ["kind", "name"],
      "properties": {
        "kind": {"$ref": "#/$defs/identity"},
        "name": {"$ref": "#/$defs/name"}
      }
    }
  }
}
