{"activation_sources":[],"availability":"available","binding":"counter_binding","binding_schema":"acsim-binding-0.2","component_schema":"ac.test.Counter","component_schema_fingerprint":"sha256:14b0d2f17152c2ad41f8cd7eb861d1069230f8e179bf0158986ba9c6d0f33cb8","construction":{"arguments":[],"kind":"constructor"},"contract_epoch":"0.2","cpp":{"concept":"gfsim::Component","entry_points":{"pure":"","reset":"counter_reset","validate":"counter_validate","work":"counter_work","xfer":"counter_xfer"},"header":"extension_provider.h","symbol":"ac_test::Counter","target":"ac_test"},"cpp_type":"uint64_t","effect":"stateful","fingerprint":"sha256:ee9bb81c62699bddda09c4e3483a75fe442ae49ccfa59eaa59621d5b2be84c74","implementation":"ac_test::Counter","ownership":{"kind":"unique","placement":"member_or_array"},"parameters":[],"ports":[],"provider":"ac_test","provider_implementation_fingerprint":"sha256:74eaae1048456c1f1426ae8bf65124b2db32ad411b23e26da323a709c36be6ba","resources":[],"results":[]}
